{"artifacts":[{"byte_length":168,"contract_version":"actkg-release-notes/1","media_type":"text/markdown","path":"RELEASE-NOTES.md","record_count":null,"required":true,"role":"release_notes","sha256":"37fd553a74a0f60ccad2b7edf9b88e5fc4126ff3ca6f3e6718f1769d3ea73d7b"},{"byte_length":275550,"contract_version":"ctkg-graph-projection/0.2","media_type":"application/json","path":"act-projection.json","profile":"runtime","record_count":null,"required":true,"role":"projection","sha256":"e100f65a2e68e6cf7ce2fae5ab31885627309ed643d8202f550f1213302174fb"},{"byte_length":18,"contract_version":"actkg-component-manifest/1","media_type":"application/json","path":"component-releases.json","record_count":null,"required":true,"role":"component_manifest","sha256":"7acf125e19d4d5f4675c7698ca93e720973b5673f9abcdff724e856cc82fd7e5"},{"byte_length":227205,"contract_version":"ctkg-json-schema/0.2","media_type":"application/schema+json","path":"ctkg.schema.json","record_count":null,"required":true,"role":"ctkg_schema","sha256":"3598f0c89f1f32ff1812e823454a17502873ccb5e9577656e6485a7e030233de"},{"byte_length":275556,"contract_version":"ctkg-graph-projection/0.2","media_type":"application/json","path":"domain-projection.json","profile":"domain","record_count":null,"required":true,"role":"projection","sha256":"5549e2d986feaed282d96b2dd2a6d1085f406a4950fae818e93128db6f47cd4c"},{"byte_length":128407,"contract_version":"actkg-projection-link-metadata/1","media_type":"application/x-ndjson","path":"projection-link-metadata.jsonl","profiles":["runtime","domain","review"],"record_count":219,"required":true,"role":"projection_link_metadata","sha256":"a98d92958ea8a5216c38e9281e617a6b4fa4941a7357374d9a92402ebaa6fe17"},{"byte_length":336,"contract_version":"actkg-provenance-stubs/1","media_type":"application/json","path":"provenance-stubs.json","record_count":null,"required":true,"role":"provenance_stubs","sha256":"8166db2a10bf9a627531b8df39e06f327e984f81db7b1e80918b978751d39a94"},{"byte_length":149631,"contract_version":"actkg-rag-crosswalk/1","media_type":"application/x-ndjson","path":"rag-crosswalk.jsonl","record_count":792,"required":true,"role":"rag_crosswalk","sha256":"de22805789a4155f260d0d1871b764ddeb776ba2d5e8235e4f21c0952d24e1ab"},{"byte_length":327512,"contract_version":"actkg-release-diff/1","media_type":"application/json","path":"release-diff.json","record_count":null,"required":true,"role":"release_diff","sha256":"fe5284b09ae03685c869d731f6f8411ee2cf21976791fd3c91441669711de1e4"},{"byte_length":124510,"contract_version":"ctkg-release/0.2","media_type":"application/json","path":"release.json","record_count":null,"required":true,"role":"release","sha256":"92bca4c2feb3ed04b0e0ef3b3e9ffacb0519aac20ce3560630f2d22098b1a7b3"},{"byte_length":275556,"contract_version":"ctkg-graph-projection/0.2","media_type":"application/json","path":"review-projection.json","profile":"review","record_count":null,"required":true,"role":"projection","sha256":"ff3cbcbd5f575f4f3e2fe263d97da2df152fe5086aada2bc1a7b8ef8c7120ade"},{"byte_length":3239,"contract_version":"actkg-validation-report/1","media_type":"application/json","path":"validation-report.json","record_count":null,"required":true,"role":"validation_report","sha256":"cb534c17a8fb960df4f3372f14c477c32a314ded97dcb5d6647150411926a717"}],"bundle_contract_version":"actkg-public-bundle/1","bundle_digest":"6e86d7a52164217721fd7b6d58bc96a3bee4da1e742bc2a51ce667bd6f87c551","bundle_id":"ctb:nonlinear-system-analysis-engineering-v0.1:r1","bundle_kind":"module","bundle_revision":1,"components":[],"normalization":"canonical-json/rfc8785-subset-v1","previous_bundle":{"bundle_id":"ctb:control-theory-engineering-v0.9:r2","kind":"legacy_exact","sha256sums_sha256":"873b9812879b3ce1c11e759e2605ce4da75b7bec62925db7fefa0cfe78f2bdfc"},"publication":{"tag":"nonlinear-system-analysis-engineering-v0.1"},"release":{"release_hash":"809e979b826ee2fc4ec79ca8a21a7268c5e5a391e9b1b8ca1b53451c1aa543f5","release_id":"ctr:release:nonlinear-system-analysis-engineering-v0.1","release_version":"nonlinear-system-analysis-engineering-v0.1","source_dataset_hash":"1670040669c690364a8418be00b110f3d8208e70506631cb07d17ae5d3120fd0"},"release_stage":"stable","schema":{"sha256":"3598f0c89f1f32ff1812e823454a17502873ccb5e9577656e6485a7e030233de","version":"0.2.0"},"source_revision":{"commit":"543d8e578e13473ce3f254d62c463de5fae593c2","tag":"nonlinear-system-analysis-engineering-v0.1-source"},"statistics":{"component_count":0,"knowledge_nodes":347,"projection_links":219,"projection_nodes":347,"published_relations":219,"rag_crosswalk_rows":792,"relation_type_count":9,"release_entries":566}}
